{
  "schemaVersion": "1.0",
  "language": "fr",
  "model": "faster-whisper/small",
  "sources": [
    {
      "sourceId": "src_talking_head",
      "segments": [
        {
          "id": "seg_001",
          "start": 0,
          "end": 6.78,
          "text": "Je suis Ozira Mobunu, je suis une jeune camionnese effectivement, j'exerce dans le",
          "words": [
            {
              "w": "Je",
              "start": 0,
              "end": 0.46,
              "p": 0.884
            },
            {
              "w": "suis",
              "start": 0.46,
              "end": 0.78,
              "p": 0.991
            },
            {
              "w": "Ozira",
              "start": 0.78,
              "end": 1.2,
              "p": 0.472
            },
            {
              "w": "Mobunu,",
              "start": 1.2,
              "end": 1.66,
              "p": 0.295
            },
            {
              "w": "je",
              "start": 2.22,
              "end": 2.44,
              "p": 0.926
            },
            {
              "w": "suis",
              "start": 2.44,
              "end": 2.64,
              "p": 0.996
            },
            {
              "w": "une",
              "start": 2.64,
              "end": 2.82,
              "p": 0.923
            },
            {
              "w": "jeune",
              "start": 2.82,
              "end": 3.02,
              "p": 0.962
            },
            {
              "w": "camionnese",
              "start": 3.02,
              "end": 3.5,
              "p": 0.471
            },
            {
              "w": "effectivement,",
              "start": 3.5,
              "end": 4.14,
              "p": 0.639
            },
            {
              "w": "j'exerce",
              "start": 5.32,
              "end": 6.24,
              "p": 0.837
            },
            {
              "w": "dans",
              "start": 6.24,
              "end": 6.68,
              "p": 0.982
            },
            {
              "w": "le",
              "start": 6.68,
              "end": 6.78,
              "p": 0.994
            }
          ]
        },
        {
          "id": "seg_002",
          "start": 6.78,
          "end": 10.56,
          "text": "domaine de la communication notamment je suis journaliste, professionnelle en",
          "words": [
            {
              "w": "domaine",
              "start": 6.78,
              "end": 6.94,
              "p": 0.983
            },
            {
              "w": "de",
              "start": 6.94,
              "end": 7.04,
              "p": 0.996
            },
            {
              "w": "la",
              "start": 7.04,
              "end": 7.14,
              "p": 0.994
            },
            {
              "w": "communication",
              "start": 7.14,
              "end": 7.72,
              "p": 0.988
            },
            {
              "w": "notamment",
              "start": 7.72,
              "end": 8.2,
              "p": 0.53
            },
            {
              "w": "je",
              "start": 8.2,
              "end": 8.48,
              "p": 0.704
            },
            {
              "w": "suis",
              "start": 8.48,
              "end": 8.7,
              "p": 0.999
            },
            {
              "w": "journaliste,",
              "start": 8.7,
              "end": 9.42,
              "p": 0.989
            },
            {
              "w": "professionnelle",
              "start": 9.74,
              "end": 10.42,
              "p": 0.953
            },
            {
              "w": "en",
              "start": 10.42,
              "end": 10.56,
              "p": 0.996
            }
          ]
        },
        {
          "id": "seg_003",
          "start": 10.56,
          "end": 15.24,
          "text": "communication, consultant même par moment et je dirige ma petite",
          "words": [
            {
              "w": "communication,",
              "start": 10.56,
              "end": 11.04,
              "p": 0.985
            },
            {
              "w": "consultant",
              "start": 11.64,
              "end": 11.94,
              "p": 0.766
            },
            {
              "w": "même",
              "start": 11.94,
              "end": 12.5,
              "p": 0.934
            },
            {
              "w": "par",
              "start": 12.5,
              "end": 12.82,
              "p": 0.634
            },
            {
              "w": "moment",
              "start": 12.82,
              "end": 13.18,
              "p": 0.531
            },
            {
              "w": "et",
              "start": 13.18,
              "end": 14,
              "p": 0.732
            },
            {
              "w": "je",
              "start": 14,
              "end": 14.72,
              "p": 0.99
            },
            {
              "w": "dirige",
              "start": 14.72,
              "end": 14.98,
              "p": 0.992
            },
            {
              "w": "ma",
              "start": 14.98,
              "end": 15.1,
              "p": 0.996
            },
            {
              "w": "petite",
              "start": 15.1,
              "end": 15.24,
              "p": 0.987
            }
          ]
        },
        {
          "id": "seg_004",
          "start": 15.24,
          "end": 20.94,
          "text": "entreprise dont je suis entrepreneur. Je suis originée du sud du Cameroon, mon",
          "words": [
            {
              "w": "entreprise",
              "start": 15.24,
              "end": 15.78,
              "p": 0.997
            },
            {
              "w": "dont",
              "start": 15.78,
              "end": 15.92,
              "p": 0.671
            },
            {
              "w": "je",
              "start": 15.92,
              "end": 16.08,
              "p": 0.999
            },
            {
              "w": "suis",
              "start": 16.08,
              "end": 16.22,
              "p": 0.998
            },
            {
              "w": "entrepreneur.",
              "start": 16.22,
              "end": 16.72,
              "p": 0.892
            },
            {
              "w": "Je",
              "start": 17.58,
              "end": 17.66,
              "p": 0.987
            },
            {
              "w": "suis",
              "start": 17.66,
              "end": 17.76,
              "p": 0.999
            },
            {
              "w": "originée",
              "start": 17.76,
              "end": 18.1,
              "p": 0.408
            },
            {
              "w": "du",
              "start": 18.1,
              "end": 18.32,
              "p": 0.997
            },
            {
              "w": "sud",
              "start": 18.32,
              "end": 18.62,
              "p": 0.678
            },
            {
              "w": "du",
              "start": 18.62,
              "end": 19.64,
              "p": 0.719
            },
            {
              "w": "Cameroon,",
              "start": 19.64,
              "end": 20.22,
              "p": 0.863
            },
            {
              "w": "mon",
              "start": 20.58,
              "end": 20.94,
              "p": 0.989
            }
          ]
        },
        {
          "id": "seg_005",
          "start": 20.94,
          "end": 26.18,
          "text": "village à Ibollova, précisement à Diop et je suis issu d'une famille de 8",
          "words": [
            {
              "w": "village",
              "start": 20.94,
              "end": 21.2,
              "p": 0.993
            },
            {
              "w": "à",
              "start": 21.2,
              "end": 21.5,
              "p": 0.387
            },
            {
              "w": "Ibollova,",
              "start": 21.5,
              "end": 21.94,
              "p": 0.542
            },
            {
              "w": "précisement",
              "start": 22,
              "end": 22.5,
              "p": 0.549
            },
            {
              "w": "à",
              "start": 22.5,
              "end": 22.64,
              "p": 0.951
            },
            {
              "w": "Diop",
              "start": 22.64,
              "end": 22.96,
              "p": 0.596
            },
            {
              "w": "et",
              "start": 22.96,
              "end": 23.8,
              "p": 0.594
            },
            {
              "w": "je",
              "start": 23.8,
              "end": 24.06,
              "p": 0.989
            },
            {
              "w": "suis",
              "start": 24.06,
              "end": 24.3,
              "p": 0.999
            },
            {
              "w": "issu",
              "start": 24.3,
              "end": 24.94,
              "p": 0.48
            },
            {
              "w": "d'une",
              "start": 24.94,
              "end": 25.12,
              "p": 0.992
            },
            {
              "w": "famille",
              "start": 25.12,
              "end": 25.46,
              "p": 0.998
            },
            {
              "w": "de",
              "start": 25.46,
              "end": 26.06,
              "p": 0.992
            },
            {
              "w": "8",
              "start": 26.06,
              "end": 26.18,
              "p": 0.806
            }
          ]
        },
        {
          "id": "seg_006",
          "start": 26.18,
          "end": 29.96,
          "text": "enfant, je suis la cinquième. J'ai démarré...",
          "words": [
            {
              "w": "enfant,",
              "start": 26.18,
              "end": 26.52,
              "p": 0.294
            },
            {
              "w": "je",